ticker,longBusinessSummary,businessSummary,industry,sector,shortName,longName,website,fullTimeEmployees,city,state,country,shortDescription
PDEX,"Pro-Dex, Inc. designs, develops, manufactures, and sells powered surgical instruments for medical device original equipment manufacturers worldwide. The company offers autoclavable, battery-powered and electric, and multi-function surgical drivers and shavers that are primarily used in the orthopedic, thoracic, and craniomaxillofacial markets. It also provides engineering, quality, and regulatory consulting services; and manufactures and sells rotary air motors to various industries. The company's products are used in hospitals, medical engineering labs, scientific research facilities, and high-tech manufacturing operations. Pro-Dex, Inc. was founded in 1978 and is headquartered in Irvine, California.",Not available,Medical Instruments & Supplies,Healthcare,"Pro-Dex, Inc.","Pro-Dex, Inc.",https://www.pro-dex.com,146,Irvine,CA,United States,"Industry: Medical Instruments & Supplies; Sector: Healthcare; Employees: 146; Location: Irvine, CA, United States"
PDLB,"Ponce Financial Group, Inc. operates as the bank holding company for Ponce Bank that provides various banking products and services. It offers various deposits, including demand, NOW/IOLA, money market, individual retirement, and savings accounts; reciprocal deposits; and certificates of deposit to individuals, business entities, and non-profit organizations. The company also provides real estate-secured loans, including one-to-four family investor-owned and owner-occupied residential; multifamily residential; nonresidential property; construction and land; commercial and industrial; and business and consumer loans. In addition, it invests in securities, which consist of U.S. government and federal agency securities and securities issued by government-sponsored or owned enterprises, as well as corporate securities, mortgage-backed securities, and Federal Home Loan Bank of New York stock. Ponce Financial Group, Inc. was founded in 1960 and is headquartered in Bronx, New York.",Not available,Banks - Regional,Financial Services,"Ponce Financial Group, Inc.","Ponce Financial Group, Inc.",https://www.poncebank.com,211,Bronx,NY,United States,"Industry: Banks - Regional; Sector: Financial Services; Employees: 211; Location: Bronx, NY, United States"
PEB,"Pebblebrook Hotel Trust (NYSE: PEB) is a publicly traded real estate investment trust (""REIT"") and the largest owner of urban and resort lifestyle hotels and resorts in the United States. The Company owns 46 hotels and resorts, totaling approximately 12,000 guest rooms across 13 urban and resort markets.",Not available,REIT - Hotel & Motel,Real Estate,Pebblebrook Hotel Trust,Pebblebrook Hotel Trust,https://www.pebblebrookhotels.com,60,Bethesda,MD,United States,"Industry: REIT - Hotel & Motel; Sector: Real Estate; Employees: 60; Location: Bethesda, MD, United States"
PEP,"PepsiCo, Inc. engages in the manufacture, marketing, distribution, and sale of various beverages and convenient foods worldwide. The company operates through seven segments: Frito-Lay North America; Quaker Foods North America; PepsiCo Beverages North America; Latin America; Europe; Africa, Middle East and South Asia; and Asia Pacific, Australia and New Zealand and China Region. It provides dips, cheese-flavored snacks, and spreads, as well as corn, potato, and tortilla chips; cereals, rice, pasta, mixes and syrups, granola bars, grits, oatmeal, rice cakes, and side dishes; beverage concentrates, fountain syrups, and finished goods; ready-to-drink tea, coffee, and juices; dairy products; and sparkling water makers and related products, as well as distributes alcoholic beverages under Hard MTN Dew brand. The company offers its products primarily under the Lay's, Doritos, Fritos, Tostitos, BaiCaoWei, Cheetos, Cap'n Crunch, Life, Pearl Milling Company, Gatorade, Pepsi-Cola, Mountain Dew, Quaker, Rice-A-Roni, Aquafina, Bubly, Emperador, Diet Mountain Dew, Diet Pepsi, Gatorade Zero, Crush, Propel, Dr Pepper, Schweppes, Marias Gamesa, Ruffles, Sabritas, Saladitas, Tostitos, 7UP, Diet 7UP, H2oh!, Manzanita Sol, Mirinda, Pepsi Black, Pepsi Max, San Carlos, Toddy, Walkers, Chipsy, Kurkure, Sasko, Spekko, White Star, Smith's, Sting, SodaStream, Lubimyj Sad, Agusha, Chudo, Domik v Derevne, Lipton, and other brands. It serves wholesale and other distributors, foodservice customers, grocery stores, drug stores, convenience stores, discount/dollar stores, mass merchandisers, membership stores, hard discounters, e-commerce retailers and authorized independent bottlers, and others through a network of direct-store-delivery, customer warehouse, and distributor networks, as well as directly to consumers through e-commerce platforms and retailers. The company was founded in 1898 and is based in Purchase, New York.",Not available,Beverages - Non-Alcoholic,Consumer Defensive,"Pepsico, Inc.","PepsiCo, Inc.",https://www.pepsico.com,319000,Purchase,NY,United States,"Industry: Beverages - Non-Alcoholic; Sector: Consumer Defensive; Employees: 319,000; Location: Purchase, NY, United States"
PERI,"Perion Network Ltd. provides digital advertising solutions to brands, agencies, and retailers in the United States and internationally. It offers a content monetization platform; search monetization solutions, including search mediation and app monetization; and a social platform that supports campaign management and media buying as a service platforms, as well as search advertising solutions. The company also provides a supply management platform; a demand management platform for campaign planning and design; an analytics platform, which provides information and performance metrics and insights; a creative optimization platform that offers ad building, tag creation, creative optimization, and post-campaign performance; and an AI platform that uses machine learning to bring intelligence to the various phases of campaigns. In addition, it offers an online video player and integrated ad server to upload, manage, and stream video content; an ad server; and a yield ad management platform. Further, the company provides a publisher management system that provides analytics and performance optimization tools, as well as reports; search-demand management systems; monetization products that integrate and onboard demand vendors; and AI systems. Additionally, it offers digital out of home (DOOH), connected tv (CTV), open web, and strategic optimization of relevant traits (SORT) solutions, as well as provides a provisional patent technology that eliminates the need for cookies. The company was formerly known as IncrediMail Ltd. and changed its name to Perion Network Ltd. in November 2011. Perion Network Ltd. was incorporated in 1999 and is headquartered in Tel Aviv, Israel.",Not available,Internet Content & Information,Communication Services,Perion Network Ltd,Perion Network Ltd.,https://www.perion.com,528,Tel Aviv,Not available,Israel,"Industry: Internet Content & Information; Sector: Communication Services; Employees: 528; Location: Tel Aviv, Israel"
PGR,"The Progressive Corporation operates as an insurance company in the United States. The company writes insurance for personal autos and special lines products, including motorcycles, RVs, and watercraft; and personal residential property insurance for homeowners and renters. It also writes auto-related liability and physical damage insurance for comprising dump trucks, log trucks, garbage trucks, tractors, trailers, straight trucks, tow trucks and wreckers, vans, pick-up trucks, and autos; business-related general liability and commercial property insurance for small businesses; and workers' compensation insurance for the transportation industry. In addition, the company offers other specialty property-casualty insurance and provide related services; personal property reinsurance products; and involved in investment activities. It sells its products through independent insurance agencies, as well as online and over the phone. The Progressive Corporation was founded in 1937 and is headquartered in Mayfield Village, Ohio.",Not available,Insurance - Property & Casualty,Financial Services,Progressive Corporation (The),The Progressive Corporation,https://www.progressive.com,66308,Mayfield,OH,United States,"Industry: Insurance - Property & Casualty; Sector: Financial Services; Employees: 66,308; Location: Mayfield, OH, United States"
PLD,"Prologis, Inc., is the global leader in logistics real estate with a focus on high-barrier, high-growth markets. At March 31, 2025, the company owned or had investments in, on a wholly owned basis or through co-investment ventures, properties and development projects expected to total approximately 1.3 billion square feet (120 million square meters) in 20 countries. Prologis leases modern logistics facilities to a diverse base of approximately 6,500 customers principally across two major categories: business-to-business and retail/online fulfillment.",Not available,REIT - Industrial,Real Estate,"Prologis, Inc.","Prologis, Inc.",https://www.prologis.com,2703,San Francisco,CA,United States,"Industry: REIT - Industrial; Sector: Real Estate; Employees: 2,703; Location: San Francisco, CA, United States"
PLTK,"Playtika Holding Corp., together with its subsidiaries, develops mobile games in the United States, Europe, the Middle East, Africa, the Asia Pacific, and internationally. The company owns a portfolio of casual and social casino-themed games. It distributes its games to the end customer through various web and mobile platforms and direct-to-consumer platforms. The company was founded in 2010 and is headquartered in Herzliya Pituach, Israel. Playtika Holding Corp. is a subsidiary of Playtika Holding UK II Limited.",Not available,Electronic Gaming & Multimedia,Communication Services,Playtika Holding Corp.,Playtika Holding Corp.,https://www.playtika.com,3500,Herzliya Pituach,Not available,Israel,"Industry: Electronic Gaming & Multimedia; Sector: Communication Services; Employees: 3,500; Location: Herzliya Pituach, Israel"
PLUS,"ePlus inc., together with its subsidiaries, provides information technology (IT) solutions that enable organizations to optimize IT environment and supply chain processes in the United States and internationally. The company sells third-party hardware, perpetual and subscription software, and maintenance; and software assurance and other third-party services. It also provides professional services, such as staff augmentation, project management, cloud consulting, Al advisory, consulting, security and collaboration solution, warehouse, configuration, and logistic service, as well as in the spaces of digital signage, EV charging solution, loss prevention and security, store opening, remodel, and store closing; and managed services comprising enhanced maintenance support or ePlus Lifecycle-Services Support, service desk, storage-as-a-service, azure recover, cloud managed, and managed security service, as well as managed service for infrastructure and cloud. In addition, the company offers financing arrangements, including sales-type and operating leases, loan, and consumption-based financing arrangement, as well as underwriting and management, and disposal of IT equipment and assets; and financing operations, such as sales, pricing, credit, contract, accounting, risk management, and asset management. Further, it finances IT equipment, communication-related equipment, medical equipment, industrial machinery and equipment, office furniture and general office equipment, transportation equipment, and other general business equipment; and provides financing solutions, including front-end processing, lifecycle and asset ownership, and end-of-life services. The company serves telecom, media and entertainment, technology, state and local government, educational institutions, healthcare, and financial services. The company was formerly known as MLC Holdings, Inc. and changed its name to ePlus inc. in 1999. ePlus inc. was founded in 1990 and is headquartered in Herndon, Virginia.",Not available,Software - Application,Technology,ePlus inc.,ePlus inc.,https://www.eplus.com,2199,Herndon,VA,United States,"Industry: Software - Application; Sector: Technology; Employees: 2,199; Location: Herndon, VA, United States"
PNC,"The PNC Financial Services Group, Inc. operates as a diversified financial services company in the United States. It operates through three segments: Retail Banking, Corporate & Institutional Banking, and Asset Management Group segments. The Retail Banking segment offers checking, savings, and money market accounts, and time deposit; residential mortgages, home equity loans and lines of credit, auto loans, credit cards, education loans, and personal and small business loans and lines of credit; and brokerage, insurance, and investment and cash management services. This segment serves consumer and small business customers through a network of branches, digital channels, ATMs, and through phone-based customer contact centers. The Corporate & Institutional Banking segment provides secured and unsecured loans, letters of credit, and equipment leases; cash and investment management, receivables and disbursement management, funds transfer, international payment, and access to online/mobile information management and reporting services; asset-backed financing, securities underwriting, loan syndications, mergers and acquisitions and equity capital markets advisory, and customer related services; and commercial loan servicing and technology solutions. It serves mid-sized and large corporations, and government and not-for-profit entities. The Asset Management Group segment offers investment and retirement planning, customized investment management, credit and cash management solutions, and trust management and administration services for high net worth and ultra high net worth individuals, and their families; and multi-generational family planning services. It also provides outsourced chief investment officer, custody, cash and fixed income client solutions, and retirement plan fiduciary investment services for institutional clients. The company was founded in 1865 and is headquartered in Pittsburgh, Pennsylvania.",Not available,Banks - Regional,Financial Services,"PNC Financial Services Group, I","The PNC Financial Services Group, Inc.",https://www.pnc.com,53686,Pittsburgh,PA,United States,"Industry: Banks - Regional; Sector: Financial Services; Employees: 53,686; Location: Pittsburgh, PA, United States"
POST,"Post Holdings, Inc. operates as a consumer packaged goods holding company in the United States and internationally. It operates through four segments: Post Consumer Brands, Weetabix, Foodservice, and Refrigerated Retail. The Post Consumer Brands segment manufactures, markets, and sells branded and private label ready-to-eat (RTE) cereals under Honey Bunches of Oats, Pebbles, and Malt-O-Meal brands; hot cereal; peanut butter under the Peter Pan brand; and branded and private label pet food under Rachael Ray Nutrish, Nature's Recipe, 9Lives, Kibbles 'n Bits and Gravy Train brands. The Weetabix segment manufactures, markets, and distributes branded and private label RTE cereal under Weetabix and Alpen brands; hot cereals and other cereal-based food products; private label cereals; and protein-based shakes under the UFIT brand, and nutritional snacks. The Foodservice segment produces and distributes egg products primarily under Papetti's and Abbotsford Farms brands, as well as potato products in the foodservice and food ingredient channels. The segment also manufactures certain meat products. The Refrigerated Retail segment produces and distributes side dish, potato, sausage products under Bob Evans, Bob Evans Farms, and Simply Potatoes brands; eggs and egg products under Bob Evans Egg Whites and Egg Beaters brands; and cheese and other dairy products under Crystal Farms brand. It serves grocery stores, mass merchandise customers, supercenters, club stores, natural/specialty stores, dollar stores, discounters, wholesalers, convenience stores, pet supply retailers, drug store customers, foodservice distributors, and national restaurant chains, as well as sells its products in the military, ecommerce, and foodservice channels. The company was founded in 1895 and is headquartered in Saint Louis, Missouri.",Not available,Packaged Foods,Consumer Defensive,"Post Holdings, Inc.","Post Holdings, Inc.",https://www.postholdings.com,11480,Saint Louis,MO,United States,"Industry: Packaged Foods; Sector: Consumer Defensive; Employees: 11,480; Location: Saint Louis, MO, United States"
PRAA,"PRA Group, Inc., a financial services company, engages in the purchase, collection, and management of portfolios of nonperforming loans worldwide. The company purchases accounts that are primarily unpaid obligations of individuals owed to credit originators. It also purchases and collects nonperforming loans, which are sold by credit originators when they choose not to pursue, or have been unsuccessful in, collecting the full balance owed. In addition, the company is involved in purchasing and collecting on nonperforming loans where the customer is involved in a bankruptcy or similar proceeding; and purchase and provide fee-based services for class action claims recoveries. Its nonperforming loans, includes general purpose and private label credit cards, consumer loans, auto loans, overdrafts, and small business loans. The company was formerly known as Portfolio Recovery Associates, Inc. and changed its name to PRA Group, Inc. in October 2014. PRA Group, Inc. was founded in 1996 and is headquartered in Norfolk, Virginia.",Not available,Credit Services,Financial Services,"PRA Group, Inc.","PRA Group, Inc.",https://www.pragroup.com,2991,Norfolk,VA,United States,"Industry: Credit Services; Sector: Financial Services; Employees: 2,991; Location: Norfolk, VA, United States"
PRG,"PROG Holdings, Inc., a financial technology holding company, provides payment options to consumers in the United States. It operates through two segments: Progressive Leasing and Vive. The company owns Progressive Leasing, an in-store, app-based, and e-commerce point-of-sale lease-to-own solutions provider; and Vive Financial, an omnichannel provider of second-look revolving credit products. It also provides buy now pay later payment options through four interest-free installments; and Build, a credit building financial management tool. The company was formerly known as Aaron's Holdings Company, Inc. and changed its name to PROG Holdings, Inc. in December 2020. PROG Holdings, Inc. was founded in 1955 and is based in Draper, Utah.",Not available,Rental & Leasing Services,Industrials,"PROG Holdings, Inc.","PROG Holdings, Inc.",https://progholdings.com,1403,Draper,UT,United States,"Industry: Rental & Leasing Services; Sector: Industrials; Employees: 1,403; Location: Draper, UT, United States"
PRVA,"Privia Health Group, Inc. operates as a national physician-enablement company in the United States. The company collaborates with physician practices, health plans, and health systems. It offers technology and population health tools to enhance providers' workflows; management services organization that enable providers to focus on their patients by reducing administrative work; and single-TIN medical group that facilitates negotiating power, clinical integration, and alignment of financial incentives. The company also operates accountable care organization, which engage patients, reduce inappropriate utilization, and enhance coordination and patient quality metrics to drive value-based care; and network for purchasers and payers that enable providers to connect with new patient populations and create custom contracts. The company was founded in 2007 and is headquartered in Arlington, Virginia.",Not available,Health Information Services,Healthcare,"Privia Health Group, Inc.","Privia Health Group, Inc.",https://www.priviahealth.com,1140,Arlington,VA,United States,"Industry: Health Information Services; Sector: Healthcare; Employees: 1,140; Location: Arlington, VA, United States"
PSTL,"Postal Realty Trust, Inc. (NYSE: PSTL) is an internally managed real estate investment trust that owns properties primarily leased to the United States Postal Service (""USPS""). PSTL is focused on acquiring the network of USPS properties, which provide a critical element of the nation's logistics infrastructure that facilitates cost effective and efficient last-mile delivery solutions. As of March 31, 2025, PSTL owned 1,738 properties (including two properties accounted for as financing leases) located in 49 states and one territory comprising approximately 6.5 million net leasable interior square feet. Subsequent to quarter-end and through April 16, 2025, PSTL closed on 25 additional properties comprising approximately 73,000 net leasable interior square feet.",Not available,REIT - Office,Real Estate,"Postal Realty Trust, Inc.","Postal Realty Trust, Inc.",https://www.postalrealtytrust.com,45,Cedarhurst,NY,United States,"Industry: REIT - Office; Sector: Real Estate; Employees: 45; Location: Cedarhurst, NY, United States"
PTEN,"Patterson-UTI Energy, Inc., through its subsidiaries, provides drilling and completion services to oil and natural gas exploration and production companies in the United States and internationally. It operates through three segments: Drilling Services, Completion Services, and Drilling Products. The Contract Drilling Services segment engages in the provision od contract and directional drilling, and measurement-while-drilling (MWD) services in onshore oil and natural gas basins; supply and rental of downhole performance motors, such as Mpact drilling motors, and Mpower MWD systems; electrical controls and automation to the energy, marine and mining industries; and servicing and re-certification of equipment for drilling contractors. This segment also provides software and services, such as MWD Survey Fault Detection, Isolation and Recovery (FDIR) services, a data analytics technology to analyze MWD survey data in real-time and identify the position of a well; HiFi Nav, which enhances FDIR by targeting improved vertical placement of the directional well within the reservoir; and HiFi Guidance, utilizes trajectory optimization to determine optimal steering recommendations and placement within the reservoir. The Completion Services segment offers services for hydraulic fracturing, wireline and pumping, completion support, and cementing; and is involved in the power solutions natural gas fueling, and last mile logistics and storage businesses. The Drilling Products segment engages in the design, manufacture, sale, and rental of matrix and steel-bodied polycrystalline diamond compact drill bits. It also rents oilfield tools; and offers specialized services for land-based oil and natural gas drilling, completion, and workover activities. The company was founded in 1978 and is headquartered in Houston, Texas.",Not available,Oil & Gas Drilling,Energy,"Patterson-UTI Energy, Inc.","Patterson-UTI Energy, Inc.",https://www.patenergy.com,9200,Houston,TX,United States,"Industry: Oil & Gas Drilling; Sector: Energy; Employees: 9,200; Location: Houston, TX, United States"
PVH,"PVH Corp., together with its subsidiaries, operates as an apparel company in the United States and internationally. The company operates through Tommy Hilfiger North America, Tommy Hilfiger International, Calvin Klein North America, Calvin Klein International, and Heritage Brands Wholesale segments. It designs and markets men's, women's, and children's branded apparel, footwear and accessories, underwear, sleepwear, outerwear, home furnishings, luggage, dresses, suits and swimwear, activewear, sportswear, socks and accessories, outerwear, golf products, footwear, watches and jewelry, eyeglasses and non-ophthalmic sunglasses, jeans wear, performance apparel, intimate apparel, dress shirts, handbags, fragrance, small leather goods, and other related products; and men's and boy's tailored clothing products, duvets, pillows, mattress pads and toppers, and feather beds. The company offers its products under its own brands, such as TOMMY HILFIGER, TOMMY JEANS, Calvin Klein, CK Calvin Klein, Calvin Klein Jeans, Calvin Klein Underwear, and Calvin Klein Performance, as well as various other owned, licensed, and private label brands. It distributes its products at wholesale in department, chain, and specialty stores; through warehouse clubs, mass market, and off-price and independent retailers; and through company-operated full-price, outlet stores, and concession locations; and through digital commerce sites. PVH Corp. was formerly known as Phillips-Van Heusen Corporation and changed its name to PVH Corp. in June 2011. The company was founded in 1881 and is based in New York, New York.",Not available,Apparel Manufacturing,Consumer Cyclical,PVH Corp.,PVH Corp.,https://www.pvh.com,16000,New York,NY,United States,"Industry: Apparel Manufacturing; Sector: Consumer Cyclical; Employees: 16,000; Location: New York, NY, United States"
