ticker,longBusinessSummary,businessSummary,industry,sector,shortName,longName,website,fullTimeEmployees,city,state,country,shortDescription
CVI,"CVR Energy, Inc., together with its subsidiaries, engages in renewable fuels and petroleum refining and marketing, and nitrogen fertilizer manufacturing activities in the United States. It operates in three segments: Petroleum, Renewables, and Nitrogen Fertilizer. The Petroleum segment refines and markets transportation fuels, such as gasoline, diesel, jet fuel, and distillates; and includes crude gathering and logistics that support the refinery operations. This segment also owns and operates a coking medium-sour crude oil refinery in Kansas; and a crude oil refinery in Oklahoma. This segment serves retailers, railroads, farm cooperatives, and other refiners/marketers. The Renewables segment refines renewable feedstocks, including soybean oil, corn oil, and other renewable feedstocks into renewable diesel; and marketing of renewables products. The Nitrogen Fertilizer segment owns and operates a nitrogen fertilizer plant in Coffeyville, Kansas that utilizes a pet coke gasification process to produce nitrogen fertilizer products; and a nitrogen fertilizer facility in East Dubuque, Illinois that produces nitrogen fertilizers in the form of ammonia and urea ammonium nitrate (UAN) and nitric acid. This segment primarily markets UAN products to agricultural customers; and ammonia products to agricultural and industrial customers. The company was founded in 1906 and is headquartered in Sugar Land, Texas. CVR Energy, Inc. is a subsidiary of Icahn Enterprises Holdings L.P.",Not available,Oil & Gas Refining & Marketing,Energy,CVR Energy Inc.,"CVR Energy, Inc.",https://www.cvrenergy.com,1595,Sugar Land,TX,United States,"Industry: Oil & Gas Refining & Marketing; Sector: Energy; Employees: 1,595; Location: Sugar Land, TX, United States"
CVLT,"Commvault Systems, Inc. provides a cyber resilience platform for protecting and recovering data and cloud-native applications in the Americas and internationally. The company offers Operational Recovery, which provides backup, verifiable recovery, and cost-optimized cloud workload mobility to ensure data availability and granular recovery; autonomous recovery for automated disaster and cyber recovery use cases to deliver backup, replication, and disaster recovery for all workloads on-premises, in the cloud, across various clouds, and in hybrid environments; and Cyber Recovery for threat scanning to hunt for threats within backup data, cyber deception, and threat detection to provide early warning of attacks. It also provides Commvault Cloud's Cleanroom Recovery for organizations to be ready to recover by providing a clean, isolated, and on-demand recovery location in the cloud, as well as the ability to test their incident response plans and recover; and Commvault HyperScale X, an intuitive, easy-to-deploy and scale-out, and integrated data protection solution to support enterprises' transformations, such as legacy scale-up infrastructures, hybrid cloud, container, and virtualized environments. In addition, the company offers Commvault Cloud Air Gap Protect, an integrated air-gapped cloud storage target that enables IT organizations to adopt cloud storage to ease digital transformation, reduce risks, and scale; and Commvault's Compliance, which provides built-in reporting, auditing, and logging to help ensure data is not modified or deleted for legal and compliance purposes. Further, it provides Commvault Cloud Rewind to restore an organization's cloud application and data environment; and Commvault's Clumio Backtrack to revert objects and datasets stored in Amazon Simple Storage Service (Amazon S3), as well as professional and customer support services. The company was incorporated in 1996 and is headquartered in Tinton Falls, New Jersey.",Not available,Software - Application,Technology,"Commvault Systems, Inc.","Commvault Systems, Inc.",https://www.commvault.com,3300,Tinton Falls,NJ,United States,"Industry: Software - Application; Sector: Technology; Employees: 3,300; Location: Tinton Falls, NJ, United States"
CWCO,"Consolidated Water Co. Ltd., together with its subsidiaries, supplies potable water, treats wastewater and water for reuse, and provides water-related products and services in the Cayman Islands, the Bahamas, the United States, and the British Virgin Islands. The company operates through Retail, Bulk, Services, and Manufacturing segments. It produces potable water from seawater utilizing reverse osmosis technology and supplies water to end-users, including residential, commercial, and government customers, as well as government-owned distributors. The company is also involved in design, construction, and sale of water production and treatment plants, as well as management and operation of water production plants, and treatment and reuse infrastructure for third parties; provision of water related consulting services; and production and supply of bulk water. In addition, it manufactures and services a range of specialized and custom water-related products and systems applicable to commercial, municipal, and industrial water production, supply, and treatment; reverse osmosis desalination, membrane separation, and filtration equipment; and piping systems, vessels, and custom-fabricated components. Consolidated Water Co. Ltd. was incorporated in 1973 and is headquartered in Grand Cayman, the Cayman Islands.",Not available,Utilities - Regulated Water,Utilities,Consolidated Water Co. Ltd.,Consolidated Water Co. Ltd.,https://www.cwco.com,307,Grand Cayman,Not available,Cayman Islands,"Industry: Utilities - Regulated Water; Sector: Utilities; Employees: 307; Location: Grand Cayman, Cayman Islands"
CXXIF,"C21 Investments Inc., an integrated cannabis company, cultivates, processes, distributes, and sells cannabis and hemp-derived consumer products in the United States. The company offers CO2, live resin, distillate, CBD cured resin, and CBD CO2 vaporizer pens; live, cured, and CBD cured resin extracts; bulk and packaged flowers; edibles; pre-rolls; tinctures; and topicals. It also provides payroll and benefits services. The company was formerly known as Curlew Lake Resources Inc. and changed its name to C21 Investments Inc. in November 2017. C21 Investments Inc. was incorporated in 1987 and is headquartered in Vancouver, Canada.",Not available,Drug Manufacturers - Specialty & Generic,Healthcare,C21 Investments Inc.,C21 Investments Inc.,https://www.cxxi.ca,138,Vancouver,BC,Canada,"Industry: Drug Manufacturers - Specialty & Generic; Sector: Healthcare; Employees: 138; Location: Vancouver, BC, Canada"
CZFS,"Citizens Financial Services, Inc., a bank holding company, provides various banking products and services for individual, business, governmental, and institutional customers. The company offers various deposit products, such as checking, savings, and time deposit accounts. Its loan products include residential, commercial, and agricultural real estate loans; commercial and industrial loans; state and political subdivision loans; and consumer loans, as well as various other specialized financial services. The company also provides professional trust administration, investment management services, estate planning and administration, custody of securities, and individual retirement accounts. In addition, it offers brokerage and financial planning services, as well as assistance in various oil and gas leasing matters; and provides mutual funds, annuities, and health and life insurance products. Citizens Financial Services, Inc. was incorporated in 1984 and is headquartered in Mansfield, Pennsylvania.",Not available,Banks - Regional,Financial Services,"Citizens Financial Services, In","Citizens Financial Services, Inc.",https://www.firstcitizensbank.com,379,Mansfield,PA,United States,"Industry: Banks - Regional; Sector: Financial Services; Employees: 379; Location: Mansfield, PA, United States"
D,"Dominion Energy, Inc. provides regulated electricity and natural gas services in the United States. It operates through Dominion Energy Virginia, Dominion Energy South Carolina, and Contracted Energy segments. The Dominion Energy Virginia segment engages in the generation, distribution, and transmission of electricity to approximately 2.8 million residential, commercial, industrial, and governmental customers in Virginia and North Carolina. The Dominion Energy South Carolina segment generates, transmits, and distributes electricity to approximately 0.8 million customers in the central, southern, and southwestern portions of South Carolina; and distributes natural gas to approximately 0.5 million residential, commercial, and industrial customers in South Carolina. The Contracted Energy segment is involved in the nonregulated long-term contracted renewable electric generation fleet and renewable natural gas facility. As of December 31, 2024, the company's portfolio of assets included approximately 30.3 GW of electric generating capacity, 10,600 miles of electric transmission lines, and 79,700 miles of electric distribution lines. The company was formerly known as Dominion Resources, Inc. Dominion Energy, Inc. was incorporated in 1983 and is headquartered in Richmond, Virginia.",Not available,Utilities - Regulated Electric,Utilities,"Dominion Energy, Inc.","Dominion Energy, Inc.",https://www.dominionenergy.com,14700,Richmond,VA,United States,"Industry: Utilities - Regulated Electric; Sector: Utilities; Employees: 14,700; Location: Richmond, VA, United States"
DGII,"Digi International Inc. provides business and mission-critical Internet of Things (IoT) connectivity products, services, and solutions in the United States, Europe, the Middle East, Africa, and internationally. The company operates in two segments, IoT Products & Services, and IoT Solutions. It offers cellular routers for mission-critical wireless connectivity; cellular modules to embed cellular communications abilities into the products to deploy and manage intelligent and secure cellular connected products; console servers to provide secure and remote access to network equipment in data centers and at edge locations; and radio frequency products, including embedded wireless modules, off-the-shelf gateways, modems, and adapters under the Digi XBee brand. The company also provides embedded system products under the Digi Connect, ConnectCore, and Rabbit brands; and infrastructure management products comprising serial servers, which offers serial port-to-Ethernet integration of devices into wired Ethernet networks; and universal serial bus solutions. In addition, it provides Digi Remote Manager and Lighthouse, a recurring revenue cloud-based service that offers a secure environment for customers to manage their connected device deployment and network devices; SmartSense by Digi for monitoring wirelessly the temperature of food and other perishable or sensitive goods, monitoring facilities or pharmacies by tracking the completion of operating tasks by employees, and quality control and incident management in food service, healthcare, and transportation/logistics industries; and Ventus for MNaaS solutions. Further, the company provides professional services, such as site planning, implementation management, application development, and customer training; data plan subscriptions; and enhanced technical support services, as well as Digi Wireless Design Services. Digi International Inc. was incorporated in 1985 and is headquartered in Hopkins, Minnesota.",Not available,Communication Equipment,Technology,Digi International Inc.,Digi International Inc.,https://www.digi.com,805,Hopkins,MN,United States,"Industry: Communication Equipment; Sector: Technology; Employees: 805; Location: Hopkins, MN, United States"
DHAI,"DIH Holding US, Inc. operates as a robotics and virtual reality (VR) technology provider for the rehabilitation industry in Europe, the Middle East, Africa, the United States, and the Asia Pacific. It offers ArmeoPower, a backbone robot for arm and hand therapy in an early stage of rehabilitation; ArmeoSpring for less severe patients that provides self-initiated repetitive arm and hand therapy in an extensive workspace; ArmeoSpring Pro; and Armeo Senso, for patients self-initiated and still structurally controlled movement patterns to completely open movement. The company also provides lower extremity products, including Erigo for gradual verticalization, leg mobilization, and intensive sensorimotor stimulation through cyclic leg loading; Lokomat, a robot-assisted therapy that enables training to increase the strength of muscles and a range of motion of joints in order to improve walking; Andago, a robotics smart control system that assists patients in walking naturally; C-Mill, creates a training environment; CAREN, a computer assisted rehabilitation environment; and GRAIL, an gait real-time analysis interactive lab solution for analysis training and research. In addition, it offers SafeGait, RYSEN, and M-Gait for gait and balance; and HocoNet and D-Flow software. DIH Holding US, Inc. was founded in 2021 and is based in Norwell, Massachusetts.",Not available,Medical Devices,Healthcare,"DIH Holding US, Inc.","DIH Holding US, Inc.",https://www.dih.com,Not available,Norwell,MA,United States,"Industry: Medical Devices; Sector: Healthcare; Location: Norwell, MA, United States"
DHX,"DHI Group, Inc. provides data, insights, and employment connections through specialized services for technology professionals and other select online communities in the United States. Its solutions include talent profiles; job postings; employer branding; and other services comprising virtual and live career events, sourcing services, and content and data services that provides tailored content to help professionals manage their careers and provide employers insight into recruiting strategies and trends. The company also operates ClearanceJobs, an online career community, which matches security-cleared professionals with employers in a secure and private environment to fill the jobs that safeguard its nation; and Dice that offers job postings of technology and non-technology companies for industries, such as positions for software engineers, big data professionals, systems administrators, database specialists, project managers, and various other technology and engineering professionals. It serves small, mid-sized, and large direct employers; staffing companies; recruiting agencies; staffing and consulting firms; and marketing departments of companies, as well as direct hiring companies. The company offers its products and services through its direct sales force and agency partner channel. The company was formerly known as Dice Holdings, Inc. and changed its name to DHI Group, Inc. in April 2015. DHI Group, Inc. was founded in 1990 and is headquartered in Centennial, Colorado.",Not available,Software - Application,Technology,"DHI Group, Inc.","DHI Group, Inc.",https://www.dhigroupinc.com,414,Centennial,CO,United States,"Industry: Software - Application; Sector: Technology; Employees: 414; Location: Centennial, CO, United States"
DLTR,"Dollar Tree, Inc. operates retail discount stores under the Dollar Tree and Dollar Tree Canada brands in the United States and Canada. The company offers consumable merchandise comprising everyday consumables, such as household paper and chemicals, food, candy, health, personal care products, and frozen and refrigerated food; variety merchandise consisting of toys, durable housewares, gifts, stationery, party goods, greeting cards, softlines, arts and crafts supplies, and other items; and seasonal goods, including Christmas, Easter, Halloween, and Valentine's Day merchandise. Dollar Tree, Inc. was founded in 1986 and is based in Chesapeake, Virginia.",Not available,Discount Stores,Consumer Defensive,"Dollar Tree, Inc.","Dollar Tree, Inc.",https://www.dollartree.com,64434,Chesapeake,VA,United States,"Industry: Discount Stores; Sector: Consumer Defensive; Employees: 64,434; Location: Chesapeake, VA, United States"
DNUT,"Krispy Kreme, Inc., together with its subsidiaries, produces doughnuts in the United States, the United Kingdom, Ireland, Australia, New Zealand, Mexico, Canada, Japan, and internationally. It operates in three segments: U.S., International, and Market Development. The company offers doughnut experiences through hot light theater and fresh shops, delivered fresh daily branded cabinets and merchandising units within grocery and convenience stores, quick service restaurants, club memberships, drug stores, and digital channels. It also operates Krispy Kreme company-owned shops and franchise shops. The company was formerly known as Krispy Kreme Doughnuts, Inc. and changed its name to Krispy Kreme, Inc. in May 2021. Krispy Kreme, Inc. was founded in 1937 and is based in Charlotte, North Carolina.",Not available,Grocery Stores,Consumer Defensive,"Krispy Kreme, Inc.","Krispy Kreme, Inc.",https://www.krispykreme.com,21000,Charlotte,NC,United States,"Industry: Grocery Stores; Sector: Consumer Defensive; Employees: 21,000; Location: Charlotte, NC, United States"
DOCN,"DigitalOcean Holdings, Inc., through its subsidiaries, operates a cloud computing platform in North America, Europe, Asia, and internationally. The company provides on-demand infrastructure and platform tools for developers at growing technology companies. It also offers infrastructure-as-a-service (IaaS) solutions comprising compute, storage, and networking products, including cloud firewalls, managed load balancers, and virtual private cloud software, as well as IP address management and domain name system management. In addition, the company provides platform-as-a-service (PaaS) and software-as-a-service (SaaS) solutions, such as managed databases; managed Kubernetes and container registry; application platform to build, deploy, and scale applications; Functions, a serverless compute solution; and Uptime for real-time uptime and latency alerts, as well as managed hosting and DigitalOcean Marketplace, a platform where developers can find pre-configured applications and solutions. Further, it offers artificial intelligence (AI)/machine learning (ML) applications comprising GPU droplets; GENAI platform, a solution for deploying AI applications; bare metal GPUS which provides access to a GPU server without any virtualization layer and gives developers with customizable server for their use case; and Jupyter Notebooks that provides cloud workspace and managed interactive development environment for exploring data and training, and building machine learning models. Its customers use its platform in various industry verticals, such as gaming, fintech, and cybersecurity, as well as for a range of use cases, including building and hosting websites, web and mobile applications development, AI integration, and building AI products and applications. DigitalOcean Holdings, Inc. was incorporated in 2012 and is headquartered in New York, New York.",Not available,Software - Infrastructure,Technology,"DigitalOcean Holdings, Inc.","DigitalOcean Holdings, Inc.",https://www.digitalocean.com,1210,New York,NY,United States,"Industry: Software - Infrastructure; Sector: Technology; Employees: 1,210; Location: New York, NY, United States"
DOCU,"DocuSign, Inc. provides electronic signature solution in the United States and internationally. The company offers AI-powered intelligent agreement management (IAM) platform to optimize the agreement management process and provides e-signature solution that enables sending and signing of agreements on various devices; Contract Lifecycle Management (CLM), which automates workflows across the entire agreement process; Document Generation streamlines the process of generating new, custom agreements; and Gen for Salesforce for automated agreement generation within Salesforce. It also provides Identify, a signer-identification option for checking government-issued IDs; Standards-Based Signatures, which support signatures that involve digital certificates; Monitor that uses advanced analytics; Notary which enables notaries public to conduct remote online notarization transactions; and Web Forms. In addition, the company offers Real Estate for eSignature that provides a way for brokers and agents to manage the entire real estate transaction digitally. eSignature and CLM are FedRAMP, an authorized version of DocuSign eSignature for U.S. federal government agencies; and life sciences modules that support compliance with the electronic signature practices. The company sells its products through direct and partner-assisted sales, and digital self-service purchasing. DocuSign, Inc. was incorporated in 2003 and is headquartered in San Francisco, California.",Not available,Software - Application,Technology,"DocuSign, Inc.","DocuSign, Inc.",https://www.docusign.com,6838,San Francisco,CA,United States,"Industry: Software - Application; Sector: Technology; Employees: 6,838; Location: San Francisco, CA, United States"
DPZ,"Domino's Pizza, Inc. operates as a pizza company in the United States and internationally. The company operates through three segments: U.S. Stores, International Franchise, and Supply Chain. It offers pizzas under the Domino's brand name through company-owned and franchised stores. It provides bread products, wings, boneless chicken, pastas, oven-baked sandwiches, dips, soft drink products and desserts. Domino's Pizza, Inc. was founded in 1960 and is headquartered in Ann Arbor, Michigan.",Not available,Restaurants,Consumer Cyclical,Domino's Pizza Inc,"Domino's Pizza, Inc.",https://ir.dominos.com,6400,Ann Arbor,MI,United States,"Industry: Restaurants; Sector: Consumer Cyclical; Employees: 6,400; Location: Ann Arbor, MI, United States"
DT,"Dynatrace, Inc. provides a security platform for hybrid and multicloud ecosystems in North America, Europe, the Middle East, Africa, the Asia Pacific, and Latin America. It operates Dynatrace, a security platform, which provides application and microservices monitoring, runtime application security, infrastructure monitoring, log management and analytics, digital experience monitoring, digital business analytics, and cloud automation. The company's platform allows its customers to modernize and automate IT operations, delivers software, and enhance user experiences. In addition, it offers implementation, consulting, and training services. The company markets its products through a combination of direct sales team and a network of partners, including resellers, system integrators, and managed service providers. The company also deliver automation and intelligence at scale across the digital enterprise. It serves customers in various industries comprising banking, financial services, government, insurance, retail and wholesale, transportation, and software. Dynatrace, Inc. was founded in 2005 and is headquartered in Waltham, Massachusetts.",Not available,Software - Application,Technology,"Dynatrace, Inc.","Dynatrace, Inc.",https://www.dynatrace.com,5200,Waltham,MA,United States,"Industry: Software - Application; Sector: Technology; Employees: 5,200; Location: Waltham, MA, United States"
DTM,"DT Midstream, Inc., together with its subsidiaries, provides integrated natural gas services in the United States. The company operates in two segments, Pipeline and Gathering. The Pipeline segment owns and operates interstate and intrastate natural gas pipelines, storage systems, and natural gas gathering lateral pipelines. This segment also engages in the transportation and storage of natural gas for intermediate and end-user customers. The Gathering segment owns and operates gas gathering systems. This segment is involved in the collection of natural gas for delivery to plants for treating, to gathering pipelines for further gathering, or to pipelines for transportation; and provision of associated ancillary services, including compression, dehydration, gas treatment, water impoundment, water transportation, water disposal, and sand mining. It serves natural gas producers, local distribution companies, electric power generators, industrials, and national marketers. The company was incorporated in 2021 and is headquartered in Detroit, Michigan.",Not available,Oil & Gas Midstream,Energy,"DT Midstream, Inc.","DT Midstream, Inc.",https://www.dtmidstream.com,556,Detroit,MI,United States,"Industry: Oil & Gas Midstream; Sector: Energy; Employees: 556; Location: Detroit, MI, United States"
