ticker,longBusinessSummary,businessSummary,industry,sector,shortName,longName,website,fullTimeEmployees,city,state,country,shortDescription
KEY,"KeyCorp operates as the holding company for KeyBank National Association that provides various retail and commercial banking products and services in the United States. It operates in two segments, Consumer Bank and Commercial Bank. The company offers various deposits and investment products; commercial leasing, investment management, consumer finance; personal finance and financial wellness, lending, student loan refinancing, mortgage and home equity, credit card, treasury, and business advisory; and wealth management and investment services for institutional, non-profit, and high-net-worth clients. It also provides lending, cash management, equipment financing, and commercial mortgage loans; and capital market products and services, such as syndicated finance, debt and equity underwriting, fixed income and equity sales and trading, derivatives, foreign exchange, mergers and acquisition, other advisory, and public finance to large corporate and institutional clients. In addition, the company offers personal and institutional trust custody services, personal financial and planning services, access to mutual funds, treasury services, and international banking services. Further, it provides community development financing, securities underwriting, brokerage, and investment banking services, as well as merchant services. The company was founded in 1849 and is headquartered in Cleveland, Ohio.",Not available,Banks - Regional,Financial Services,KeyCorp,KeyCorp,https://www.key.com,16989,Cleveland,OH,United States,"Industry: Banks - Regional; Sector: Financial Services; Employees: 16,989; Location: Cleveland, OH, United States"
KEYS,"Keysight Technologies, Inc. offers electronic design and test solutions worldwide. It operates in two segments, Communications Solutions Group and Electronic Industrial Solutions Group. It offers oscilloscopes; electronic design automation software; instrument measurement software, instrument workflow software, application software testing, keysight instrument control software and connectivity, and software testing; modular instruments; digital multimeter, phase noise measurement, power meters and power sensors, counters, LCR meters and impedance measurement products, and electrometers; spectrum, logic, noise figure, and network analyzers; and protocol analyzers and exercisers, bit error ratio testers, AC and DC power analyzers, materials test equipment, device current waveform analyzers, and curve tracers. It also provides signal, waveform, and function generators; arbitrary waveform generators, DC power supplies, and DC electronic loads; wireless drive test, radio access and core network test, wireless analyzers, wireless network emulators, channel emulation, and over-the-air test; application and threat intelligence, cloud test, 5G NR base station test, cyber training simulator, network test hardware, protocol and load test, network security test, and network modeling; bypass switches, cloud visibility and synchronization, network and application monitoring, network packet brokers and taps; and application-specific test systems, in-circuit test systems, parametric test, laser interferometers and calibration systems, monolithic laser combiners and precision optics, photonic test and measurement products, MMIC millimeter-wave and microwave devices, and accessories. In addition, it offers product support, technical and application support, installation, training, engineering, and integration services. The company was founded in 1939 and is headquartered in Santa Rosa, California.",Not available,Scientific & Technical Instruments,Technology,Keysight Technologies Inc.,"Keysight Technologies, Inc.",https://www.keysight.com,15400,Santa Rosa,CA,United States,"Industry: Scientific & Technical Instruments; Sector: Technology; Employees: 15,400; Location: Santa Rosa, CA, United States"
KLIC,"Kulicke and Soffa Industries, Inc. engages in the design, manufacture, and sale of capital equipment and tools used to assemble semiconductor devices. It operates through four segments: Ball Bonding Equipment, Wedge Bonding Equipment, Advanced Solutions, and Aftermarket Products and Services (APS). The company offers ball bonding equipment, wafer level bonding equipment, wedge bonding equipment; and advanced display, die-attach, and thermocompression systems and solutions, as well as tools, spares and services for equipment. It also services, maintains, repairs, and upgrades equipment. The company serves integrated device manufacturers, outsourced semiconductor assembly and test providers, other electronics manufacturers, foundry service providers, and automotive electronics suppliers primarily in the United States and the Asia/Pacific region. The company was founded in 1951 and is headquartered in Fort Washington, Pennsylvania.",Not available,Semiconductor Equipment & Materials,Technology,"Kulicke and Soffa Industries, I","Kulicke and Soffa Industries, Inc.",https://www.kns.com,2677,Fort Washington,PA,United States,"Industry: Semiconductor Equipment & Materials; Sector: Technology; Employees: 2,677; Location: Fort Washington, PA, United States"
KMI,"Kinder Morgan, Inc. operates as an energy infrastructure company primarily in North America. The company operates through Natural Gas Pipelines, Products Pipelines, Terminals, and CO2 segments. The Natural Gas Pipelines segment owns and operates interstate and intrastate natural gas pipeline, and storage systems; natural gas gathering systems and natural gas processing and treating facilities; natural gas liquids fractionation facilities and transportation systems; and liquefied natural gas gasification, liquefaction, and storage facilities. The Products Pipelines segment owns and operates refined petroleum products, and crude oil and condensate pipelines; and associated product terminals and petroleum pipeline transmix facilities. The Terminals segment owns and/or operates liquids and bulk terminals that stores and handles various commodities, including gasoline, diesel fuel, renewable fuel and feedstocks, chemicals, ethanol, metals, and petroleum coke; and owns tankers. The CO2 segment produces, transports, and markets CO2 to recovery and production crude oil from mature oil fields; owns interests in/or operates oil fields and gasoline processing plants; and operates a crude oil pipeline system in West Texas, as well as owns and operates RNG and LNG facilities. The company was formerly known as Kinder Morgan Holdco LLC and changed its name to Kinder Morgan, Inc. in February 2011. Kinder Morgan, Inc. was founded in 1997 and is headquartered in Houston, Texas.",Not available,Oil & Gas Midstream,Energy,"Kinder Morgan, Inc.","Kinder Morgan, Inc.",https://www.kindermorgan.com,10933,Houston,TX,United States,"Industry: Oil & Gas Midstream; Sector: Energy; Employees: 10,933; Location: Houston, TX, United States"
KNX,"Knight-Swift Transportation Holdings Inc., together with its subsidiaries, provides freight transportation services in the United States and Mexico. The company operates through four segments: Truckload, Less-than-truckload (LTL), Logistics, and Intermodal. The Truckload segment provides transportation services, which include irregular route and dedicated, refrigerated, expedited, flatbed, and cross-border operations. This segment operates an average of 22,791 tractors, which includes 20,644 company tractors and 2,147 independent contractor tractors, as well as 92,831 trailers. The LTL segment offers regional LTL transportation services through a network of approximately 170 service centers; and national coverage through partner carrier outside the network. This segment operates an average of 3,569 tractors and 9,564 trailers. The Logistic segment provides brokerage and other freight management services through third-party transportation providers and equipment. The Intermodal segment offers transportation services, including freight through third-party intermodal rail services on trailing equipment, such as containers and trailers on flat cars; and drayage services. This segment operates an average of 615 tractors and 12,572 intermodal containers. The company also provides repair and maintenance shop, equipment leasing, warranty, and insurance services; and warehousing and driving academy services, as well as manufactures trailer parts. It serves retail, food and beverage, consumer and paper products, transportation and logistics, housing and building, automotive, and manufacturing industries. The company was incorporated in 1989 and is headquartered in Phoenix, Arizona.",Not available,Trucking,Industrials,Knight-Swift Transportation Hol,Knight-Swift Transportation Holdings Inc.,https://knight-swift.com,35300,Phoenix,AZ,United States,"Industry: Trucking; Sector: Industrials; Employees: 35,300; Location: Phoenix, AZ, United States"
KO,"The Coca-Cola Company, a beverage company, manufactures and sells various nonalcoholic beverages in the United States and internationally. The company provides sparkling soft drinks and flavors; water, sports, coffee, and tea; juice, value-added dairy, and plant-based beverages; and other beverages. It also offers beverage concentrates and syrups, as well as fountain syrups to fountain retailers comprising restaurants and convenience stores. The company sells its products under the Coca-Cola, Diet Coke/Coca-Cola Light, Coca-Cola Zero Sugar, caffeine free Diet Coke, Cherry Coke, Fanta Orange, Fanta Zero Orange, Fanta Zero Sugar, Fanta Apple, Sprite, Sprite Zero Sugar, Simply Orange, Simply Apple, Simply Grapefruit, Fresca, Schweppes, Thums Up, Aquarius, Ayataka, BODYARMOR, Ciel, Costa, Crystal, Dasani, dogadan, Fuze Tea, Georgia, glacéau smartwater, glacéau vitaminwater, Gold Peak, I LOHAS, Powerade, Topo Chico, Core Power, Del Valle, fairlife, innocent, Maaza, Minute Maid, Minute Maid Pulpy, and Simply brands. It operates through a network of independent bottling partners, distributors, wholesalers, and retailers, as well as through bottling and distribution operators. The company was founded in 1886 and is headquartered in Atlanta, Georgia.",Not available,Beverages - Non-Alcoholic,Consumer Defensive,Coca-Cola Company (The),The Coca-Cola Company,https://www.coca-colacompany.com,69700,Atlanta,GA,United States,"Industry: Beverages - Non-Alcoholic; Sector: Consumer Defensive; Employees: 69,700; Location: Atlanta, GA, United States"
KRT,"Karat Packaging Inc., together with its subsidiaries, engages in the manufacture and distribution of single-use disposable products in plastic, paper, biopolymer-based, and other compostable forms used in various restaurant and foodservice settings. It offers food and take-out containers, bags, boxes, tableware, cups, lids, cutlery, straws, specialty beverage ingredients, gloves, utensils, janitorial and warehouse supplies, and other products under the Karat Earth brand. The company also distributes food and beverage items, such as syrups, boba tea, and coffee drinks; and provides new product development, design, printing, and logistics services. It offers its products to national and regional distributors, restaurant chains, retail establishments, and online customers. The company was founded in 2000 and is based in Chino, California.",Not available,Packaging & Containers,Consumer Cyclical,Karat Packaging Inc.,Karat Packaging Inc.,https://www.karatpackaging.com,683,Chino,CA,United States,"Industry: Packaging & Containers; Sector: Consumer Cyclical; Employees: 683; Location: Chino, CA, United States"
KVUE,"Kenvue Inc. operates as a consumer health company in the United States, Europe, the Middle East, Africa, Asia-Pacific, and Latin America. It operates through three segments: Self Care, Skin Health and Beauty, and Essential Health. The Self Care segment offers cough, cold and allergy, pain care, digestive health, smoking cessation, eye care, and other products under the Tylenol, Motrin, Benadryl, Nicorette, Zarbee's, ORSLTM, Rhinocort, Calpol, and Zyrtec brands. Its Skin Health and Beauty segment provides face and body care, hair, sun, and other care products under the Neutrogena, Aveeno, Dr.Ci:Labo, Le Petit Marseillais, Lubriderm, Rogaine, and OGX brand names. The Essential Health segment offers oral and baby, women's health, wound, and other care products under the Listerine, Johnson's, Band-Aid, and Stayfree, o.b., tampons, Carefree, and Desitin Diaper Rash brands. Kenvue Inc. was incorporated in 2022 and is headquartered in Summit, New Jersey.",Not available,Household & Personal Products,Consumer Defensive,Kenvue Inc.,Kenvue Inc.,https://www.kenvue.com,22000,Summit,NJ,United States,"Industry: Household & Personal Products; Sector: Consumer Defensive; Employees: 22,000; Location: Summit, NJ, United States"
L,"Loews Corporation, through its subsidiaries, provides commercial property and casualty insurance in the United States and internationally. The company offers specialty insurance products, such as management and professional liability, and other coverage products; surety and fidelity bonds; professional liability coverages and risk management services to various professional firms, including architects, real estate agents, and accounting and law firms; standard and excess property, marine and boiler and machinery coverages, workers' compensation, general and product liability, commercial auto, umbrella, and excess and surplus coverages, and specialized loss-sensitive insurance programs and total risk management services relating to claim and information services; directors and officers, errors and omissions, employment practices, fiduciary, fidelity, and cyber coverages, as well as for small and mid-size firms, public and privately held firms, and not-for-profit organizations; and insurance products to serve the health care industry, including professional and general liability, as well as associated casualty coverage to aging services, allied medical facilities, dentists, physicians, nurses, and other medical practitioners. It also provides warranty and alternative risk and run-off long-term care insurance products. The company markets its insurance products and services through independent agents, brokers, and managing general underwriters. In addition, it engages in the transportation and storage of natural gas and natural gas liquids; and provision of ethane supply and transportation services for industrial customers in Louisiana and Texas, as well as operates a chain of 25 hotels. Further, the company develops, manufactures, and markets a range of extrusion blow-molded and injection molded plastic containers, as well as manufactures commodity and differentiated plastic resins. Loews Corporation was incorporated in 1969 and is headquartered in New York, New York.",Not available,Insurance - Property & Casualty,Financial Services,Loews Corporation,Loews Corporation,https://www.loews.com,13000,New York,NY,United States,"Industry: Insurance - Property & Casualty; Sector: Financial Services; Employees: 13,000; Location: New York, NY, United States"
LAKE,"Lakeland Industries, Inc., together with its subsidiaries, manufactures and sells industrial protective clothing and accessories for the industrial and public protective clothing market worldwide. It offers firefighting and heat protective apparel to protect against fire; high-end chemical protective suits to provide protection from highly concentrated, toxic and/or lethal chemicals, and biological toxins; and limited use/disposable protective clothing, such as coveralls, laboratory coats, shirts, pants, hoods, aprons, sleeves, arm guards, caps, and smocks. The company provides durable woven garments; high performance FR/AR apparel; and firefighter protective apparel and accessories. In addition, it provides high visibility clothing comprising reflective apparel, including vests, T-shirts, sweatshirts, jackets, coats, raingear, jumpsuits, hats, and gloves; and gloves and sleeves that are used in the automotive, glass, and metal fabrication industries. The company sells its products to a network of safety and industrial supply distributors through in-house sales teams, customer service group, and independent sales representatives. It serves end users, such as integrated oil, chemical/petrochemical, automobile, steel, glass, construction, smelting, cleanroom, janitorial, pharmaceutical, and high technology electronics manufacturers, as well as scientific, medical laboratories, and the utilities industry; and federal, state, and local governmental agencies and departments. The company was incorporated in 1982 and is headquartered in Huntsville, Alabama.",Not available,Apparel Manufacturing,Consumer Cyclical,"Lakeland Industries, Inc.","Lakeland Industries, Inc.",https://www.lakeland.com,2050,Huntsville,AL,United States,"Industry: Apparel Manufacturing; Sector: Consumer Cyclical; Employees: 2,050; Location: Huntsville, AL, United States"
LCII,"LCI Industries, together with its subsidiaries, manufactures and supplies engineered components for the manufacturers of recreational vehicles (RVs) and adjacent industries in the United States and internationally. It operates through two segments, Original Equipment Manufacturers (OEM) and Aftermarket. The OEM segment manufactures and distributes a range of engineered components, such as steel chassis, axles, anti-lock braking systems, and suspension systems; manual, electric, and hydraulic stabilizer and leveling systems; awnings, slide-out mechanisms, and accessories; vinyl, aluminum, and frameless windows; entry, luggage, patio, and ramp doors; electric and manual entry steps; thermoformed bath and kitchen products; furniture, mattresses, tankless water heaters, air conditioners, appliances, electronic components, televisions, and sound systems; windshields; and hitches, pin boxes, grill guards, towing electrical, and towing and truck accessories. This segment serves OEMs of RVs and adjacent industries, including boats, buses, cargo and utility trailers used to haul boats, livestock, equipment, and other cargo; trucks; trains; manufactured homes; and modular housing. The Aftermarket segment supplies engineered components to aftermarket channels of the recreation and transportation markets for retail dealers, wholesale distributors, and service centers, as well as direct-to-consumer sales through online platforms. This segment also sells replacement glass and awnings to fulfill insurance claims; and biminis, covers, buoys, fenders, towing products, truck accessories, appliances, air conditioners, televisions, sound systems, and tankless water heaters. The company was formerly known as Drew Industries Incorporated and changed its name to LCI Industries in December 2016. LCI Industries was founded in 1956 and is headquartered in Elkhart, Indiana.",Not available,Recreational Vehicles,Consumer Cyclical,LCI Industries,LCI Industries,https://corporate.lippert.com,11500,Elkhart,IN,United States,"Industry: Recreational Vehicles; Sector: Consumer Cyclical; Employees: 11,500; Location: Elkhart, IN, United States"
LE,"Lands' End, Inc. operates as a digital retailer of apparel, swimwear, outerwear, accessories, footwear, home products, and uniforms in the United States, Europe, and internationally. It operates through U.S. eCommerce, Europe eCommerce, Outfitters, Third Party, Licensing, and Retail segments. The company also sells uniform and logo apparel to businesses and their employees, and student households; and earns royalties on the use of Lands' End trademark. It sells its products through its e-commerce websites and company operated stores, as well as through third party distribution channels under the Lands' End, Lands' End Lighthouse, Squall, Tugless Tank, Drifter, Outrigger, Marinac, Wanderweight, Beach Living, Supima, No-Gape, Anyweather, Waveshaper, Starfish, Little Black Suit, Iron Knees, Hyde Park, Year'Rounder, ClassMate, Willis & Geiger, and ThermaCheck brands. Lands' End, Inc. was founded in 1963 and is headquartered in Dodgeville, Wisconsin.",Not available,Apparel Retail,Consumer Cyclical,"Lands' End, Inc.","Lands' End, Inc.",https://www.landsend.com,2432,Dodgeville,WI,United States,"Industry: Apparel Retail; Sector: Consumer Cyclical; Employees: 2,432; Location: Dodgeville, WI, United States"
LEA,"Lear Corporation designs, develops, engineers, manufactures, assembles, and supplies automotive seating, and electrical distribution systems and related components for automotive original equipment manufacturers in North America, Europe, Africa, Asia, and South America. Its Seating segment offers seat systems, seat subsystems, keyseat components, seat trim covers, seat mechanisms, seat foams, and headrests, as well as surface materials, such as leather and fabric for automobiles and light trucks, compact cars, pick-up trucks, and sport utility vehicles. The company's E-Systems segment provides electrical distribution and connection systems that route electrical signals and networks; and manage electrical power within the vehicle for various powertrains. This segment's products comprise wire harnesses, terminals and connectors, engineered components, and junction boxes; electronic system products, including body domain control modules, smart and passive junction boxes, gateway and communication modules, integrated power modules, and high voltage switching and power control systems. It also offers software and connected services comprising Xevo Market, an in-vehicle commerce and service platform; and software and services for the cloud, vehicles, and mobile devices. In addition, this segment provides cybersecurity software; advanced vehicle positioning for automated and autonomous driving applications; and short-range communication and cellular protocols for vehicle connectivity. It offers its products and services under the XEVO, GUILFORD, EAGLE OTTAWA, ConfigurE+, INTUTM, LEAR CONNEXUSTM, EXO, JOURNEYWARE, ProTec, SMART JUNCTION BOX, STRUCSURE, AVENTINO, and TeXstyle brands. Lear Corporation was founded in 1917 and is headquartered in Southfield, Michigan.",Not available,Auto Parts,Consumer Cyclical,Lear Corporation,Lear Corporation,https://www.lear.com,173700,Southfield,MI,United States,"Industry: Auto Parts; Sector: Consumer Cyclical; Employees: 173,700; Location: Southfield, MI, United States"
LESL,"Leslie's, Inc. operates as a direct-to-consumer pool and spa care brand in the United States. The company markets and sells pool and spa supplies and related products and services. It also offers various pool and spa maintenance items, such as chemicals, equipment and parts, and cleaning accessories, as well as safety, recreational, and fitness related products. In addition, the company provides installation and repair services for pool and spa equipment. It also sells its products through e-commerce websites and third-party marketplaces. The company offers complimentary and commercial-grade in-store water testing and analysis services. It serves residential, professional, and commercial consumers. The company was founded in 1963 and is headquartered in Phoenix, Arizona.",Not available,Specialty Retail,Consumer Cyclical,"Leslie's, Inc.","Leslie's, Inc.",https://lesliespool.com,3850,Phoenix,AZ,United States,"Industry: Specialty Retail; Sector: Consumer Cyclical; Employees: 3,850; Location: Phoenix, AZ, United States"
LII,"Lennox International Inc., together with its subsidiaries, designs, manufactures, and markets products for the heating, ventilation, air conditioning, and refrigeration markets in the United States, Canada, and internationally. The Home Comfort Solutions segment provides furnaces, air conditioners, heat pumps, packaged heating and cooling systems, indoor air quality equipment, comfort control products, and replacement parts and supplies; residential heating, ventilation, cooling equipment, and air conditioning; and evaporator coils and unit heaters under Lennox, Dave Lennox Signature Collection, Armstrong Air, Ducane, AirEase, Concord, MagicPak, Advanced Distributor Products, Allied, Elite Series, Merit Series, Comfort Sync, Healthy Climate, iComfort, ComfortSense, and Lennox Stores name. The Building Climate Solutions segment offers unitary heating and air conditioning equipment, applied systems, controls, installation and service of commercial heating and cooling equipment, variable refrigerant flow commercial, curb, curb adapters, drop box diffusers, HVAC recycling, and salvage service. This segment also provides condensing units, unit coolers, fluid coolers, air cooled condensers, air handlers, and refrigeration rack systems for preserving food and other perishables; and compressor racks and industrial process chillers under the Lennox, Model L, CORE, Enlight, Xion, Energence, Prodigy, Strategos, Raider, Lennox VRF, Lennox National Account Services, Allied Commercial, Elite, AES Industries, Mechanical, and Reclaim, Heatcraft Worldwide and Chandler Refrigeration, Bohn, MAGNA, Larkin, Climate Control, Chandler Refrigeration, IntelliGen, and Interlink brand name. In addition, the company provides small package units, rooftop units, chillers, air handlers, and fan coils. It sells its products and services through direct sales, distributors, and company-owned parts and supplies stores. The company was founded in 1895 and is headquartered in Richardson, Texas.",Not available,Building Products & Equipment,Industrials,"Lennox International, Inc.",Lennox International Inc.,https://www.lennox.com,14200,Richardson,TX,United States,"Industry: Building Products & Equipment; Sector: Industrials; Employees: 14,200; Location: Richardson, TX, United States"
